<?xml version="1.0" encoding="UTF-8"?>
<CaloomBase xmlns:xsi="http://www.w3.org/2001/XMLSchema-instance" xsi:noNamespaceSchemaLocation="CaloomBase.xsd">
<Services>
	<Service name="TestService">
		<What>
			<Description activeInSearch="false" activeInInfo="false">Test service description</Description>
			<How>
				<Free></Free>
				<Other></Other>
				<Sell></Sell>
			</How>
			<Images activeInSearch="false" activeInInfo="true">
				<Image>Some-image-url</Image>
			</Images>
			<Info activeInSearch="false" activeInInfo="false">Info text</Info>
			<Keywords activeInSearch="true" activeInInfo="false">
				<Keyword>Some keyword 1</Keyword>
				<Keyword>Some keyword 2</Keyword>
			</Keywords>
		</What>
		<Where>Where text - needs structured content specified</Where>
		<When>When text - needs structured content specified</When>
		<Whom>Whom text - needs structured content specified</Whom>
		<Worth>Worth text - needs structured content specified</Worth>
	</Service>
		<Service name="Xyz">
		<What>
			<Description activeInSearch="false" activeInInfo="false">Test service description</Description>
			<How>
				<Free></Free>
				<Other></Other>
				<Sell></Sell>
			</How>
			<Images activeInSearch="false" activeInInfo="true">
				<Image>Some-image-url</Image>
			</Images>
			<Info activeInSearch="false" activeInInfo="false">Info text</Info>
			<Keywords activeInSearch="true" activeInInfo="false">
				<Keyword>Some keyword 1</Keyword>
				<Keyword>Some keyword 2</Keyword>
			</Keywords>
		</What>
		<Where>Where text - needs structured content specified</Where>
		<When>When text - needs structured content specified</When>
		<Whom>Whom text - needs structured content specified</Whom>
		<Worth>Worth text - needs structured content specified</Worth>
		</Service>
</Services>
</CaloomBase>
